{
  "schema_version": "1.0.0",
  "run_id": "HR001",
  "attempt_id": "AT001",
  "project_id": "project/harness-study",
  "task_id": "HARNESS002",
  "role": "research-agent",
  "lease": {
    "token": "lease-token-001",
    "expires_at": "2099-01-01T00:00:00+00:00"
  },
  "context": {
    "summary": "Offline adapter contract fixture.",
    "source_refs": ["fixture/source-001"],
    "constraints": ["Do not publish or send external data."]
  },
  "instructions": ["Return one structured result."],
  "write_targets": [
    {"path": "07_runtime", "mode": "UPDATE"}
  ],
  "acceptance_ids": ["AT001"],
  "attempt_workspace": ".",
  "deadline": "2099-01-01T00:00:00+00:00",
  "capabilities": {
    "required": ["structured-output"],
    "declared": ["structured-output"],
    "environment_allowlist": []
  }
}
